Theme,Business Interpretation,Recommendation
Chips & Snack Satisfaction,"Snack products are driven heavily by taste, texture, and perceived health/value balance.",Focus on optimizing flavor profiles and highlight health/value positioning in snack marketing.
Tea Flavor & Brew Strength,"Tea satisfaction depends on flavor strength, aroma consistency, and proper brewing expectations.",Provide clearer brewing instructions and ensure flavor consistency across batches.
Chocolate & Sweet Snack Experience,"Chocolate and sweet snacks are judged on richness, sweetness balance, and texture quality.",Refine sweetness levels and improve texture consistency for chocolate products.
General Product Satisfaction / Value Issues,Mixed reviews often stem from mismatched expectations around product quality and perceived value.,Align pricing with perceived value and improve product descriptions to set accurate expectations.
Gluten-Free & Peanut Butter Products,Specialty dietary products must meet both taste expectations and strict ingredient requirements.,Ensure ingredient transparency and improve flavor quality in specialty diet products.
"Price, Ordering, Shipping & Availability","Logistics issues (shipping delays, damage, incorrect items) strongly impact customer satisfaction independent of product quality.","Improve packaging durability, shipping speed, and accuracy of product fulfillment."
Dog Food & Treat Acceptance,"Dog product success is highly dependent on pet acceptance, digestibility, and perceived safety.",Increase product testing for palatability and safety across a wide range of dogs.
Cat Food Health & Acceptance,"Cat food performance is closely tied to health outcomes, ingredient trust, and pet preference.",Prioritize high-quality ingredients and communicate health benefits clearly for cat products.
Coffee Quality & Strength,"Coffee reviews are highly sensitive to strength, freshness, roast profile, and brewing compatibility.",Optimize roast consistency and clearly communicate strength/flavor expectations.
General Taste & Flavor Complaints,"General dissatisfaction is often driven by unnatural taste, weak flavor, or off-putting texture.","Reformulate products with poor taste feedback and ensure natural, appealing flavor profiles."
